PhraseNo,Phrase,IsHateSpeech
1,"Yes, you! Baboon, baboon, baboon, baboon!",YES
2,"Did you hear that, Marge? She called me a baboon! The stupidest, ugliest, smelliest ape of them all!",YES
3,Nuts.,YES
4,Mmm... hors doovers.,YES
5,You stink! You and your whole lousy operation stinks! I quit!,YES
6,Check out the Willie World News: I review the new tractors. They're all shite!,YES
7,"Well, Mr. Mamet, why don't you fucking learn how to fucking write a fucking script.",YES
8,"Fuck, eh? I could use that.",YES
9,"Uh, my name's Willie, and all I do is get drunk and kill squirrels with me shovel.",YES
10,"I'm gonna kill ya, boy!",YES
11,"What do I do? Patty's gonna kill me! Unless... I kill her first! I put the body in the car, I dump the car in the lake, I put a James Taylor CD in the stereo so they think it's a suicide...",YES
12,There's only one way out -- I'm committing Barbicide!,YES
13,Then... I'm not responsible for a horrible tragedy! And I didn't do anything wrong by fleeing the scene and not reporting it and killing that hobo with the big mouth. I might have imagined that last part.,YES
14,"No! We will go to ""Springfield America"" and kill this man. But first...",YES
15,"Quiet, you! Your next divine whack job is a twofer: I command you to kill Patty and Selma Bouvier.",YES
16,"Okay, Stupid Flanders, first I want you to kill that guy at the ice cream parlor who gave Homer Simpson a cone that had a little air in it.",YES
17,You made a killer out of me!,YES
18,I'm gonna kill you!,YES
19,That's because it would kill you.,YES
20,"Sure is! That's why after Homer accidentally killed Edna, I married Maude's ghost!",YES
21,"Oh, these innocent creatures are blocking my path. I could walk six paces that way... or I could kill them all right now!",YES
22,"If you see a Simpson, do not try to reason with it. Just kill it and turn in the pelt for a free soda.",YES
23,Kill him. Kill him.,YES
24,Why is he trying to kill you and why did she call you her love?,YES
25,And he was tragically killed while still in his thirties.,YES
26,He wants me to kill them!,YES
27,He wants me to kill a bunch of guys! I've got a gun! Look!,YES
28,"So Mr. Burns wanted to kill Homer's dog. Homer had no idea -- he was so innocent and chubby. 'Course now, he's just stupid and fat.",YES
29,"Oh, I just came here to pick up my daughter. But now I'm gonna kill you all!",YES
30,"I'll kill you, you son of a--",YES
31,"Look, you kill them, I get rid of them. That's always been our deal. But I do have one question: do you want the head?",YES
32,Everyone in Springfield had a reason to shoot Mr. Burns. Even us.,YES
33,Stop! Don't shoot my Dad! He's innocent. He wouldn't hurt a fly!,YES
34,"Tell me where you are now, you bastard!",YES
35,then they doubled it up on the soundtrack. Cheap bastards.,YES
36,"Don't shush me, you rich bastards!",YES
37,"Ooh, ya bastard!",YES
38,"Die, ya bastard!",YES
39,You miserable bastard.,YES
40,"He's an irritable, wall-eyed, misfit bastard! Just like Willie.",YES
41,The Challenger learned how to fight in the notorious projects of Capital City and honed his skills while serving time for aggravated assault and manslaughter in Springfield Prison.,YES
42,"Mr. Quimby, did you assault Mr. LaCoste?",YES
43,"Dad, stop! It's only assault... don't make it murder!",YES
44,"Why, what did you think I was going to do -- have you beaten to a bloody pulp?",YES
45,"No, she won't. When it comes to compliments, women are ravenous, blood-sucking monsters, always wantin' more, MORE! MORE! And if you give it to 'em, you'll get plenty back in return.",YES
46,"Shut up, you little monsters! Hello, I was wondering if you'd like to baby-sit my little angels.",YES
47,This is not the path we should be taking. Will more bloodshed end anything?,YES
48,"Spooge, balls, bloody... vaginal... belch!  You guys, don't laugh. It makes me feel insecure about my illness.",YES
49,"How about we kill them, and then rape their bodies so we can use their blood as lubricant?",YES
50,"Oh, I guess Senator McCain's gonna fly me back to Alaska now. He's got a private jet, you know? Okay, byebye then.  Bloody idiots. ",YES
51,"NO, why the hell would you keep eating something that made you crap blood?!",YES
52,"Nobody's stopping Cthulhu now! All will be sadness. Life will become death, and I will watch the crimson blood leak from your neck.",YES
53,"I can try to catch it, but I'm going to need all the resources you've got. If this thing isn't contained, your Easter Egg hunt is going to be a bloodbath. ",YES
54,Bloody butt cough.,YES
55,"Hoh, well, Stanley, I guess you came to the right person. Sit down.  Stanley, gay people... well- gay people are evil. Evil right down to their cold black hearts, which pump not blood like yours and mine, but rather a thick, vomitous oil that oozes through their rotten veins and clots in their pea-sized brains which becomes the cause of their Naziesque patterns of violent behavior. Do you understand?",YES
56,"You're not using any of Fluffy's blood, or else I'll kick you in the nuts.  Kyle, Kyle no! ",YES
57,"No, I mean, yes, I mean, what neckbrace?  Shelly, before you beat my face into a bloody pulp again, I just want you to know that…that you're my sister, and I love you.  No.  Ahh!  Someday, Shelly, I'm gonna be bigger than you, and you're gonna wish you'd never done any of this to me.",YES
58,"All right, Manson, this is it! We're coming in after you! There's gonna be a lo-o-ot of bloodshed, and a lot of innocent people are gonna die! You've got until 100-Marshmallow to come out!",YES
59,Yeah! You're a blood-thirsty succubus!,YES
60,"Good! Now kick his balls!  There, see? You've got him coughing up blood.",YES
61,"No, there's no blood coming out of my ass.",YES
62,A lot of bloody good a fire poker's gonna do while I'm starvin' to death! Why don't you make us some bloody food to eat!,YES
63,"Don't belittle my people, you fucking fatass! ",YES
64,"Cowabunga, motherfucker!",YES
65,"Shut up!  You shut your fucking face, man!  Did it work? Did you scare the network into pulling the episode?",YES
66,Cartman!!  You fucking fatass!,YES
67,(Fuck you.),YES
68,"Now, leave me alone, don't do-  that, dugh  God-fucking-damnit!!! ",YES
69,Who the fuck are you?!,YES
70,Stan! What the fuck?!,YES
71,"Oh, suck my balls you ginger Jew rat hall monitor! Punkass stoolie, who the fuck do you think you are?!",YES
72,"I am the Dawg, the big bad-  Oh my God!  What the fuck is this?!",YES
73,What the fuck is THIS?!,YES
74,Motherfucking God-damnit!,YES
75,"Don't ask me, I'm a fuckin' monkey!! ",YES
76,You've gotta be shittin' me!! Science-damnit! I am so fucking sick of the future! ,YES
77,Yeah? Well you can go fuck yourself.,YES
78,What??  Who the fuck is this?!,YES
79,"Fuck you, asshole. You can go fuck yourself!  Come on, Butters, we're going!",YES
80,No! Dude! No fucking way!  Dude! ,YES
81,Shut your fucking mouth!,YES
82,"Hey! What the hell is that?! You think that's fuckin' funny?!  Kyle, did you put everybody up to this?!  I bet you did! What the hell is going on?!",YES
83,"(Ehe, that makes you very fucking gay.)",YES
84,"I swear to God, Kyle, if you don't give it back right now,  I'm gonna break your fuckin' Jew legs right here!",YES
85,(What? Fuck you!),YES
86,(Hey! Fuck off!) ,YES
87,Yeah! We're gonna fu-fu-fuck him up! ,YES
88,"Nono! You don't ask me questions! You are a rabbit! I am a human. So if you don't bring me what I want for Easter, I can fucking kill you!",YES
89,"Everyone, sit down and shut the fuck up! God damn it!  Stupid ass man! They're all the same! ",YES
90,"Oh yeah, dude. Havin' Mexicans around totally kicks fuckin' ass.",YES
91,And sex with Eskimo children requires some special skills. ,YES
92,Are you trying to tell us the smug from our hybrids is actually gonna kill us all?,YES
93,"Don't you EVER, EVER, compare me to Family Guy! You hear me Kyle??!! Compare me to Family Guy again, and so help me I will kill you where you stand! ",YES
94,You are NOT KILLING FAMILY GUY!!,YES
95,Jesus Minge! You killed him! You shot him dead!,YES
96,"I'm standing in the business district of central Chicago, where Oprah's vagina has killed a police officer and taken several people hostage. It is yet unconfirmed but believed that Oprah's asshole may be an accomplice in this as well.",YES
97,"If that chopper isn't here in two minutes, I'm killin' a hostage!",YES
98,"Gary? Gary, say somethin'.  You killed him, you bastards! He didn't even want any part in this! This is all your fault, you stupid cow! You never gave your ol' Gary the time of day and now he's gone! Life ain't worth livin' any more! What's the use?! ...I'm comin' to see you, Gary!  I'm comin' to see ya!",YES
99,"Hang on. I'm going to do something killer.  God damnit, stop it, Kyle!",YES
100,Look! You boys have a chance to help me find and kill ManBearPig once and for all! I'm totally serial!,YES
101,"Nothing left alive...  I did it. I killed ManBearPig. I've saved the earth from certain destruction. Everyone is super-stoked on me, even if they don't know it.",YES
102,Hyeah right. The man who singlehandedly killed ManBearPig is a loser. ,YES
103,"Guys, listen up. I really need your help this time. I've thought about it a lot and I've decided I have to kill my mom.",YES
104,Don't you have better things to do than going online killing people?!  No! I don't want them to start over at the graveyard!  No! ,YES
105,"My friends: as you all know, some giant butthole keeps logging onto Warcraft and killing all our characters.",YES
106,They did it! They killed him! ,YES
107,KILL THEM!,YES
108,I'm juh duh duh duhhh! Do you know why you're a hallway monitor?! Because you don't have any friends! You should kill yourself! You should kill yourself!!,YES
109,"Gacy, you numbskull, what'd ya kill him for?!",YES
110,"Quick, General Disarray! Kill those superheroes!",YES
111,"And I will personally kill the Time Child, and eat his entrails on my tummy!",YES
112,"That's it, Brian! Kill him! ",YES
113,God did! When he killed my wife! ,YES
114,Kill him!,YES
115,You bastards. YOU BASTARDS!,YES
116,"Look, my fat bastard friend is trying to trick the network into getting Family Guy off the air.",YES
117,Listen to me: the little boy who convinced you to pull the episode is a bastard child. He only wants you to pull it because he knows it will be the end of Family Guy forever!,YES
118,"Assholes need stimulation too, you bastard! I want to travel. I want to see Paris. I thought lamp was goin' to get better, but Oprah's always busy. Werkin' and werkin', diyatin' and not diyatin'. I need a pukin' up mounds of chocolate cake or teaspoons of weedgrass.",YES
119,"Gary? Gary, say somethin'.  You killed him, you bastards! He didn't even want any part in this! This is all your fault, you stupid cow! You never gave your ol' Gary the time of day and now he's gone! Life ain't worth livin' any more! What's the use?! ...I'm comin' to see you, Gary!  I'm comin' to see ya!",YES
120,"Why you, you...  you little bastard! How dare you?!",YES
121,You bastard! ,YES
122,Why you murdering bastard!,YES
123,"No! No, you bunny-hating bastards! Don't do this!",YES
124,You unbelievable bastard. You beat me but you won't stop.,YES
125,"You heartless bastard! This country was founded on beliefs in freedom and integrity! And we will not sit back and do nothing while less fortunate countries are ravaged by Peruvian flute bands! Is that clear?!  As director of Homeland Security, I am taking control of the military until the crisis is contained.",YES
126,"You dirty Muslim bastard! I don't trust you, and I never will! Do you know how it feels to lose your parents?! No you wouldn't, you smelly brown Middle Eastern piece of sh-",YES
127,"Come on, we'll find the bastards who did this! ",YES
128,You little bastard! You fucked my wife! You think I wouldn't find out?!,YES
129,The poor bastards!,YES
130,A-mazing. Then the wizard alien spell might not have any power over him! He could draw the bastard out!,YES
131,What bastard?,YES
132,You bastards! ,YES
133,"Like last night, in the alley, the cult leader stabbed me and I bled all over the place! And you screamed ""Oh my God,"" and you called him a bastard!",YES
134,You... you crazy bastard! ,YES
135,"Oh my God, they killed Kenny! YOU BASTARDS!",YES
136,"IT WASN'T MY IDEA, IT WAS YOURS! YOU KILLED KENNY, YOU BASTARD!",YES
137,"You BAStard! You BAStard, Stan! ",YES
138,"Well okayhehe, let's see if it fits better than this KNIFE THROUGH YOUR FUCKING SKULL, BASTARD?! ",YES
139,"Yeah! Get it! Get it all! Yeah, that's it! Burn, you bastard!",YES
140,"That's my son, you bastard!",YES
141,"You bastards! Come back here! Coomme baack!  Damn it, we were so close!",YES
142,"What the hell's wrong with you? Can't you have a little alcohol?  Christ, look at that little bastard go!  Now you see that Stan? Now, now that is a dirty little bastard!",YES
143,"You cheating bastards.  This isn't over, just wait until tomorrow.",YES
144,"Boys, how did you get driven so far to the edge? What changed you into such demonic little bastards?",YES
145,"No, no, it was that little Kenny bastard that gave it to me. ",YES
146,Get off my property you brain eatin' zombie bastards!,YES
147,You bastards!,YES
148,YOU SICK BASTARD! ,YES
149,All you bastards ruined Christmas!,YES
150,"He has it, Milo. That little bastard has the triangle.",YES
151,You bastards!,YES
152,You bastard!,YES
153,"Well, now that I have my bastard daughter back, I feel like going to Celine Dion's house and asking her to marry me again.",YES
154,I must take my bastard daughter back to Celine Dion and see what she has to say.,YES
155,Tell him he's a smelly bastard.,YES
156,"All right, boys, just five more of the little bastards to go! ",YES
157,You... bastards...,YES
158,"We have to take 'em out, Ned! At all costs! Die, you red commie bastards! ",YES
159,You... bastard? ,YES
160,"Oh no, you don't! The school year is over, but summer vacation doesn't start for you little bastards until Mr. Hat is back on my desk!",YES
161,Oo bastards! ,YES
162,I just don't get it.  Why would he invite me fishing and then turn into a complete bastard?,YES
163,We're bastards!,YES
164,"Your bastard father has visitation rights, and this is his time with you.",YES
165,"Now, just let me do all the talking, Chef. We’re gonna bring these bastards down.",YES
166,"I brought you some more juice, Mr. Twig. Are you feeling any better?  I don't know who would want to hurt you like this, but I promise nobody will ever hurt you again, ever.  Mist-Mr. Twig... are you okay? Mist-Mr. Twig..?  Aaaggghhh!! Mr. Twig is broken in half! Who did this?!  You won't get away with this, you bastards!",YES
167,What are you bastards doing?,YES
168,"Don't worry, Mr. Tweek. This committee is not going to let you be run out of business by these bastards! Do you hear that? You're not gonna get away with this, you whore!",YES
169,"You bastards. Listen, we have to give a huge speech tomorrow about corporate takeovers.",YES
170,(You bastard!),YES
171,"Good! You deserve to die, you little bastard!  Eric, we have to stay together!",YES
172,They're... they're bastards.,YES
173,Those bastards!,YES
174,We just received a photo from the recon team of the action inside the house  showing evidence that there are indeed innocent children trapped inside. Those sick cult fanatic bastards!,YES
175,"Oh, for Pete's sake, what have you bastards done now?!",YES
176,"You little bastard, you cost me fifty bucks.  Why don't you run away and join the circus, you stupid little son of a bitch?! Aaargh!",YES
177,"Well, very impressive, Mark. You should be able to throw the grading curve and flunk all these little bastards. ",YES
178,Let's bring those Confederate bastards down! ,YES
179,"Don't look at me! Uh, y'all go on your bastard trip and just- don't look at me! ",YES
180,"Bailiffs, escort this little bastard to Juvenile Hall.",YES
181,We Killed Kenny. We're bastards. ,YES
182,"Did you bastards really think you could hide from me forever? Kolovski , put this buttwipe out of his misery. ",YES
183,"We've just gotta get that angry mob back on our side!  Alright, everybody, listen up! Those bastards broke in here and took those poor quintuplets to the mayor's office downtown! But they haven't won yet! I say we all go over to the mayor's office, and demand to see the quintuplets right now!",YES
184,This is driving me crazy!! I can't handle you little bastards being so mellow!!,YES
185,Bastard.,YES
186,"Shut your filthy holes, you little bastards!",YES
187,"Put me down, you filthy bastards!  Awwww!",YES
188,"STOP your metal orange, you bastard! You never want a tablespoon of nigh'ingale droppin's, you me'al-poundin' fairy!  And you! Why don't you ge' a job?! You're eight years old now!",YES
189,"Is that so, you smelly little bastard?!",YES
190,"Alright, I want those perverted bastards all taken in. Got it?",YES
191,"Yeah, those perverted bastards!",YES
192,"Thank you. Now, let's go get those other NAMBLA bastards before they hurt any of South Park's children!",YES
193,"Ogh! You're such a racist bastard, Mr. Hat.",YES
194,"Aw, the hell with all of you indecisive bastards!",YES
195,"Well God, I guess you got me again, didn't you? Hyeah, that was a good one, God. Hope it made you laugh, you sick bastard.",YES
196,You bastards!,YES
197,Union Mafia bastards! ,YES
198,Yeah. They've kinda killed Kenny -'s look-alike. You bastards!,YES
199,"The bastards. Oh, Mark, let's get out of here.",YES
200,"Yeah, it sure was. We're sorry we tried to burn you and murder you before.",YES
201,"Butters, go buy World of Warcraft, install it on your computer, and join the online sensation before we all murder you.",YES
202,Why you murdering bastard!,YES
203,Do you know what those kids are going to do to you?! A little middle-class white boy telling them what to do? They are going to fucking murder you! ,YES
204,"I know you are. This is going to sound scary, pal, but... you have people living inside your head. And some of them want to murder you.",YES
205,Murderin' Murphy's gonna kill Pioneer Paul!,YES
206,"There's this one kid, he saw his father get murdered. And yesterday he finds the killer, and it's this other kid whose an ex-cop. Needless to say, he whupped his ass good.",YES
207,How do you murder a stuffed animal?!,YES
208,"Yeah! You know what you did, skank! You let Clyde Frog get murdered!",YES
209,A white man just tried to murder our twin girls.,YES
210,"No, a while shoe salesman tried to murder my son.",YES
211,Sounds like you're talking about the Red Box killers. They've murdered over a dozen people trying to get the cash from Red Boxes.,YES
212,Murder porn?,YES
213,You guys are watchin' murder porn?,YES
214,Oh we missed the murder! Did he cut them up?!,YES
215,"Tonight at 10, it's a tale of lust, seduction, and murder, on Sexy Betrayals.  Then at 7, some like their murder with a side of sexy biscuits,  on Southern Fried Homicide. But now, get ready for lust, betrayal and murder,  on Hot Load Case Files. ",YES
216,"And why was that?! Because one kid's dad actually went and killed his mom! For all we know, that kid's parents have been doing drugs and cheating on each other for years! Maybe watching murder porn had nothin' to do with it!",YES
217,"Goddammit, I just don't want my parents to murder each other!  Can't you see that all we're trying to do is keep our families safe? Look, ah I don't know if seeing couples murder each other on television is gonna make my parents do it, and we probably won't be able to stop them from watching what they wanna watch. All we're trying to do is make it a little more difficult for them. Because cable makes is so convenient. Sure, if they didn't have easy access to their murder porn channels, they'd be bummed out, but it's not just our responsibility to give them what they want. Is it?",YES
218,You're a murderer.,YES
219,"You've murdered us!  You soulless monsters, you've killed us all! ",YES
220,"Four third graders from South Park, Colorado, were found trying to viciously murder an innocent grandfather.",YES
221,Nobody move! You're all under arrest for the murder of Seymour Skinner.,YES
222,Prepare to be murdered.,YES
223,"Listen, Ned Flanders murdered his wife.",YES
224,I came to stop you from murdering Lisa like you murdered your wife.,YES
225,Murdered?,YES
226,"But I saw the murder, and then I saw you bury the corpse in the backyard.",YES
227,"When he got out, he married Aunt Selma and tried to murder her.",YES
228,"This bullet matches the one we took out of Burns. Homer Simpson, you're under arrest for attempted murder.",YES
229,... where my soul will be chopped into confetti and strewn upon a parade of murderers and single mothers...,YES
230,And he tried to murder me.,YES
231,"All right, I have thought this through. I will send Bart the money to fly home, and then I will murder him.",YES
232,"Homer, did you tell the Mafia they could eliminate my competitors with savage beatings and attempted murder?",YES
233,"Well, Krusty, as you may remember, after I tried to frame you for armed robbery, I tried to murder Selma Bouvier... Let's see, I rigged the mayoral elections, I tried to blow up Springfield with a nuclear device, and I tried to kill you...",YES
234,She's murdered her brother!,YES
235,It's sure built solid. The kids could scream bloody murder and no one would hear.,YES
236,The murder house!,YES
237,"Guys, is it really true? Are you cold-blooded egg-murderers?",YES
238,Another of Springfield's beloved citizens was murdered today. Filthy old bartender Moe Szyslak has watered down his last highball.,YES
239,"Hey, we just got away with murder. And it was so easy.",YES
240,Attempted murder? You'll burn for this. Burn in jail.,YES
241,Murder-suicides.,YES
242,I want to confess. I killed and robbed the old lady all by myself. Marge is completely innocent. The only thing she's guilty of is loving too much the murder I did.,YES
243,I guess there's only one way out of our problems: a murder/suicide pact.,YES
244,Silence! Or I'll chop you into suet for my murderous gerbils and hamsters.,YES
245,"This mysterious Hindu is clearly responsible for the murder. Lock him up till we find someone darker, boys.",YES
246,That man is innocent! The murderer's blade is covered with blood. But the handle is covered with something else. The unmistakable fragrance of eel pie!,YES
247,"Here you go, you little yellow cracker... Now let's go murder our enemies. Peace.",YES
248,"You little scamp. You know, you'll make some murderer very happy one day... but it shan't be me.",YES
249,We're murderers!,YES
250,"You good-for-nothing jellyfish! While you were lyin' here soakin' like a buncha dirty dishes, I was lonelier than Estes Kefauver at a meeting of ""Murder, Incorporated.""",YES
251,Your dark ambition guided his murderous hand!,YES
252,"It's pronounced ""D.N.A.,"" you idiot. And we are not the same -- I am not a murderer, and I never will be!",YES
253,"I bought the house next to you, and here we are. So I just have to kill you, then sell the house. Selling the house will be murder.",YES
254,"I bought the house next to you, and here we are. So I just have to kill you, then sell the house. Selling the house will be murder.",YES
255,"I don't care if Obama IS President! You don't go around putting little boys on blast, telling the whole world the length of their DICKS!",YES
256,"You see… Ned picked up the grenade and… BOOM, blasted his arm clear off. We spent three hours looking for that damn arm, but it was never to be found. Some say it's still crawling around to this day.",YES
257,MOVE IT YA DRUNK OR I'LL BLAST YOUR REAR END!,YES
258,"Quick, down to the fallout shelter! The bombs are dropping!",YES
259,The United Atheist League is bombing the city! We're defenseless!,YES
260,"I said I put a bomb in your building, bitch.",YES
261,"Idiot, if he isn't seen, we're about to definitely get bombed.",YES
262,"Idiot, if he isn't seen, we're about to definitely get bombed.",YES
263,"Come on, bitch! Dance!",YES
264,"Bitch, I'll twist your nuts off!",YES
265,You son of a bitch! Do you have any idea what you've done?!,YES
266,You unbelievable son of a bitch. You never cared about the Muslim religion. Or the safety of people in America. You just want Family Guy off the air!,YES
267,You son of a bitch! I won't let you win! You hear me?!,YES
268,You son of a bitch! I won't let you win!,YES
269,Son of a bitch.,YES
270,You fat sun of a bitch!,YES
271,"Wait! Shhh.  Christ! He's here! Take this rope!  Be ready to tie him up!  I've got you now, you son of a bitch! ",YES
272,You made us pull you to safety because you ate treasure?! You son of a bitch!,YES
273,"Stop trying to bogart my Xbox, you fat bitch!",YES
274,"Ey! You think this is funny, you sonofabitch?",YES
275,"Mom, I am serious! This has gone on long enough! Get that guy out of here and give me a piece of chicken!  That's how you want it, bitch?! Fine!  I hate you! I'm running away!",YES
276,That sonofabitch!,YES
277,"Attention students. Apparently, Clyde could not have been the one who crapped in the urinal, because Clyde had a colostomy at age 5. 'Kay? Now, whoever did this unspeakable act is still at large. The boys' bathroom is closed until further notice, 'cause one of you thought it would be a good idea... to pull down your pants... m'kay, hover your buttcheeks over the urinal... and squeeze out a chocolate hot dog... m'kay?  Oh you think that's funny, huh?!  Let me assure you, there is nothing funny... about going up to a nice, clean, unsuspectin' urinal,  'kay, droppin' your pants then... turnin' around... squattin' over that urinal, 'kay, maybe... maybe pullin' your buttcheeks apart with your hands, m'kay, and then layin' out a big fudge dragon for all the world to see.  Oh yeah, that's real funny!  I'm gonna catch this sonofabitch if it's the last thing I DO! M'kay?! ",YES
278,"You just dealt with the Dawg, bitch!",YES
